{
  "schema_version": "3.0.0-draft",
  "artifact_kind": "sample_export_index",
  "content_class": "REFERENCE_SAMPLE_NOT_OFFICIAL",
  "candidate_id": "candidate_025",
  "release_id": "app-sha256:f88ae3a638651a182392c2b3e6a4d2937dd00f597c43efc6ae0e176abaa3b99c",
  "run_id": "local-run-73d8eaec3a8b5c97",
  "operator_run_token": "local_token_73d8eaec3a8b5c97",
  "mission_id": "mission_025",
  "app_release_binding": {
    "package_name": "com.scpc.deliveryagent",
    "version_name": "1.0.0",
    "version_code": "1",
    "app_release_sha256": "f88ae3a638651a182392c2b3e6a4d2937dd00f597c43efc6ae0e176abaa3b99c",
    "signing_certificate_sha256": "f75fb6d157734f4ef4f1e777c193a0bfe54e0bfb9bc369113971fe1001489919"
  },
  "source_binding": {
    "source_archive_sha256": "eb9aa78e40641c74b7a554868102fb6e56dd2632c47c14951c6c98cddc03b690",
    "mission_adapter_relative_path": "android/app/src/main/assets/MISSION_ADAPTER.json",
    "mission_adapter_sha256": "0d8562a1d564a05dfe79777a8bb98b01395a033546653513c1381f1cba0e8503"
  },
  "file_manifest": [
    {
      "relative_path": "EVIDENCE_INDEX.json",
      "sha256": "20e33e7b282c6b52b3f7e54300a1560d459551593296988612889336c39aa520",
      "size_bytes": 7798
    },
    {
      "relative_path": "MISSION_LOCK.json",
      "sha256": "00e66dec58933807d15d73dfd45cc8ef25d0549edef9e6a54de75955a42b73da",
      "size_bytes": 3837
    },
    {
      "relative_path": "PUBLIC_PROBE_RESULT.json",
      "sha256": "4d0ece8b2cacd97744a71c45d4f76004cdc8c89a18077309248b7e600435564f",
      "size_bytes": 11888
    },
    {
      "relative_path": "RUNTIME_IDENTITY.json",
      "sha256": "f0b806f00dda79a8df2e05bad86ffdae9c8e7b922c705c58b4f0101c6c6a6fc6",
      "size_bytes": 1484
    },
    {
      "relative_path": "evidence/ledger/ev.ledger.actions.json",
      "sha256": "1a481e4f08dd1a6519ba8e68db45d622e416d491a589a7d6c8238f828ba1925c",
      "size_bytes": 806
    },
    {
      "relative_path": "evidence/ledger/ev.ledger.outcomes.json",
      "sha256": "7bb911bb53d930075d7c251ed427bd23d22b8c92f58c38cf01d81495d0a21481",
      "size_bytes": 389
    },
    {
      "relative_path": "evidence/receipts/rc.PUBLIC-01.json",
      "sha256": "3b24a2ade5b599867c80a839cba560c8b938536b234637593a9c15450b09f465",
      "size_bytes": 967
    },
    {
      "relative_path": "evidence/receipts/rc.PUBLIC-02.json",
      "sha256": "ebb528c8afc06d09a2940e47fb8984d09b8a4818669dccdb37486e1e9e88d12f",
      "size_bytes": 963
    },
    {
      "relative_path": "evidence/receipts/rc.PUBLIC-03.json",
      "sha256": "ae33bde58759e9e81094aaa88f4651909498b6e4e9b5c206cdc5cbbdfb9315e9",
      "size_bytes": 967
    },
    {
      "relative_path": "evidence/receipts/rc.PUBLIC-04.json",
      "sha256": "69a58d5129bc7f3d1170bff8768cd3f7cb63e8e7509f6141df4b08ba63621b1c",
      "size_bytes": 1319
    },
    {
      "relative_path": "evidence/receipts/rc.PUBLIC-05.json",
      "sha256": "1c6c5a933228bf4ee44cd9d5e871e6c9d5a706937ac98cf2c7934aadce3e359b",
      "size_bytes": 967
    },
    {
      "relative_path": "evidence/receipts/rc.PUBLIC-06.json",
      "sha256": "cf0ddec4b0aae3db0339663b7b406c0cfdb066f33028b0798d8d9e96359cb324",
      "size_bytes": 967
    },
    {
      "relative_path": "evidence/receipts/rc.PUBLIC-07.json",
      "sha256": "e0ff5a1721970ad13ed9f07937924921c154f8e401ef7053b151b659fcfa4a2d",
      "size_bytes": 967
    },
    {
      "relative_path": "evidence/receipts/rc.PUBLIC-08.json",
      "sha256": "d83e07ec53cb1711dfe792789c95b87e68233528e678d288b9f4f05dda41f027",
      "size_bytes": 960
    },
    {
      "relative_path": "evidence/receipts/rc.PUBLIC-09.json",
      "sha256": "bad12072037ccd7e2132d131e0f2214e9120c57120984242b45991285ff610a3",
      "size_bytes": 967
    },
    {
      "relative_path": "evidence/receipts/rc.PUBLIC-10.json",
      "sha256": "bf8ed3855be083740fd6cc3e84d88cb6e2df06719b27c1e2a4aba8a4f97e6a82",
      "size_bytes": 1327
    },
    {
      "relative_path": "evidence/receipts/rc.PUBLIC-11.json",
      "sha256": "183be270c4ab601518955becc89ecbbfe5488626aa2a6157f0a43ea72c797e60",
      "size_bytes": 963
    },
    {
      "relative_path": "evidence/receipts/rc.PUBLIC-12.json",
      "sha256": "09246fd37da94fc044ef619740c316d63d7697bae96eada06656243aff471760",
      "size_bytes": 963
    },
    {
      "relative_path": "evidence/receipts/rc.PUBLIC-13.json",
      "sha256": "6ecbd5ec425ffe160b4791d4f287d86c3c1b9d3cbac2770c10b86d1f9437228e",
      "size_bytes": 963
    },
    {
      "relative_path": "evidence/state/ev.state.authority.json",
      "sha256": "843951cf94f4473043a701e953305037ca2eb17dc2849e85cfb185dac69a25af",
      "size_bytes": 691
    },
    {
      "relative_path": "evidence/state/ev.state.context_selection.json",
      "sha256": "fada9028ae0a8d20533a848c4bde96f8599e5c4066e6a3dd6df2de3b481dcd2b",
      "size_bytes": 401
    },
    {
      "relative_path": "evidence/state/ev.state.current_goal.json",
      "sha256": "81696929988d6a15cfc9f32bd87a86ac02816b82eb29fd38d124cd88ca288755",
      "size_bytes": 262
    },
    {
      "relative_path": "evidence/state/ev.state.deletion.json",
      "sha256": "8ab7ba46992dc34ecd83afb2d875d14a475e031a362c2eb55822e891bb38d9b5",
      "size_bytes": 458
    },
    {
      "relative_path": "evidence/state/ev.state.facts.json",
      "sha256": "05fe8e091b1036227d2f98fbd00adb1ae38ff771305810eda721d7c9badb854b",
      "size_bytes": 1643
    },
    {
      "relative_path": "evidence/state/ev.state.invalidation.json",
      "sha256": "10888c8454318d8ded93b25ed03a0dd89f521dc2c548054d1de7847e5ecc9a5d",
      "size_bytes": 1915
    },
    {
      "relative_path": "evidence/state/ev.state.recovery.json",
      "sha256": "9e34cab8b9785e011f0ac9ccc55f1cf766af88f922bdc1fb561b4ec24cf7ba62",
      "size_bytes": 390
    },
    {
      "relative_path": "evidence/steps/ev.PUBLIC-01.step.json",
      "sha256": "9d60539cb80a4898378d4c1f7daf182637de9e56e4a350338475e9d478184b90",
      "size_bytes": 584
    },
    {
      "relative_path": "evidence/steps/ev.PUBLIC-02.step.json",
      "sha256": "b434130d7dbc9506cd75817cbd54fdbc8bce96b4557c53d3338c9d14a3346512",
      "size_bytes": 2205
    },
    {
      "relative_path": "evidence/steps/ev.PUBLIC-03.step.json",
      "sha256": "f1aed1809a78451a69d67a2e107051d450f7186cb36199fca5223191aa95f980",
      "size_bytes": 1987
    },
    {
      "relative_path": "evidence/steps/ev.PUBLIC-04.step.json",
      "sha256": "5153f7e5badccb24395a66e65d0330846f472ec35b9b1453c99c71195421724f",
      "size_bytes": 1920
    },
    {
      "relative_path": "evidence/steps/ev.PUBLIC-05.step.json",
      "sha256": "e5266740ab71e05eef6a1deb10b3929d5bf6b68ca76af966fc7b91af9d58fc45",
      "size_bytes": 2023
    },
    {
      "relative_path": "evidence/steps/ev.PUBLIC-06.step.json",
      "sha256": "492c436868e3bf32229fa622f88206c04dc313f429c456b5ab84447bd225a1de",
      "size_bytes": 2016
    },
    {
      "relative_path": "evidence/steps/ev.PUBLIC-07.step.json",
      "sha256": "726c335905a4b8b39071f626869b24e8bcb7e052355617e8f26bdc4c69716a3c",
      "size_bytes": 1840
    },
    {
      "relative_path": "evidence/steps/ev.PUBLIC-08.step.json",
      "sha256": "f0ec98bacbf2d1cd3e64c2a908cc6c08abfb40fef36b335f8a35a72ff95ffadc",
      "size_bytes": 1817
    },
    {
      "relative_path": "evidence/steps/ev.PUBLIC-09.step.json",
      "sha256": "2fd7d015421f549f90114951210a20a2e6f2a11d3f994bf2dc603897a3fea202",
      "size_bytes": 777
    },
    {
      "relative_path": "evidence/steps/ev.PUBLIC-10.step.json",
      "sha256": "653f5b5aaa7fb21f19c046bfdd388dc5a057d58ad5bc7576663fe8ed95c3e255",
      "size_bytes": 724
    },
    {
      "relative_path": "evidence/steps/ev.PUBLIC-11.step.json",
      "sha256": "39d0d02ba7390a59b2ca30617755270c9c56849d211e02181367f7c2cb73dccc",
      "size_bytes": 816
    },
    {
      "relative_path": "evidence/steps/ev.PUBLIC-12.step.json",
      "sha256": "f8f17b1b5ee55f890599730c038ce54d52b66b33647ef171964c233883620abb",
      "size_bytes": 2509
    },
    {
      "relative_path": "evidence/steps/ev.PUBLIC-13.step.json",
      "sha256": "b3a108d7e190f966170697173f4ec59ddcf0bd962e6dccfbc01b298939e8dd22",
      "size_bytes": 2372
    }
  ],
  "total_uncompressed_bytes": 66812
}
